{
  "contractVersion": "1.0",
  "authorizationRequestId": "authreq-change-r1-001",
  "createdAt": "2026-08-30T09:30:02.200-03:00",
  "requester": {
    "id": "overcore-execution-environment",
    "kind": "execution-environment"
  },
  "authorityProvider": {
    "id": "omni-authority-provider",
    "kind": "assistant"
  },
  "requestBinding": {
    "requestId": "req-20260830-change-001",
    "requestFingerprint": {
      "algorithm": "sha256-jcs-v1",
      "value": "sha256:44340c327366e5c0c78780634343b74720dfff72be25e70a4cfff87b23bbb6e7"
    },
    "clientId": "client-primary-assistant"
  },
  "planBinding": {
    "planId": "plan-change-001",
    "planRevision": 1,
    "planFingerprint": {
      "algorithm": "sha256-jcs-v1",
      "value": "sha256:753e28d45a8b113e6229aafdba6ad8d4ffc27403de44896f3cb159d6a4822366"
    },
    "strategyFingerprint": {
      "algorithm": "sha256-jcs-v1",
      "value": "sha256:4cacdebff2d82278d6592b865a80090e4d30ebbeda74758c4fec1517d999e3dd"
    }
  },
  "authorityCeiling": {
    "mode": "proceed-within-scope",
    "grants": [
      {
        "resourceRef": "ref-overcore-readme",
        "operations": ["filesystem.read", "filesystem.modify"]
      },
      {
        "resourceRef": "ref-task-request-doc",
        "operations": ["filesystem.read"]
      }
    ],
    "expansionBoundaries": [
      "destructive",
      "irreversible",
      "financial",
      "privilege-expansion",
      "external-publication",
      "secret-access"
    ]
  },
  "actions": [
    {
      "actionId": "action-read-readme",
      "stepRef": "step-change-inspect",
      "position": 1,
      "scope": "request-resource",
      "resourceRef": "ref-overcore-readme",
      "operation": "filesystem.read",
      "effectMode": "none",
      "effectClass": "read-only",
      "riskLevel": "low",
      "requestedControls": ["sanitize-output"]
    },
    {
      "actionId": "action-read-task-request-doc",
      "stepRef": "step-change-inspect",
      "position": 2,
      "scope": "request-resource",
      "resourceRef": "ref-task-request-doc",
      "operation": "filesystem.read",
      "effectMode": "none",
      "effectClass": "read-only",
      "riskLevel": "low",
      "requestedControls": ["sanitize-output"]
    },
    {
      "actionId": "action-modify-readme-link",
      "stepRef": "step-change-apply",
      "position": 3,
      "scope": "request-resource",
      "resourceRef": "ref-overcore-readme",
      "operation": "filesystem.modify",
      "effectMode": "journaled",
      "effectKey": "task-20260830-change-001/readme-reference",
      "effectClass": "reversible-change",
      "riskLevel": "medium",
      "requestedControls": [
        "checkpoint-before-mutation",
        "verify-after-effect",
        "reconcile-before-retry",
        "revocation-check-before-effect"
      ]
    },
    {
      "actionId": "action-read-link-result",
      "stepRef": "step-change-verify-link",
      "position": 4,
      "scope": "request-resource",
      "resourceRef": "ref-overcore-readme",
      "operation": "filesystem.read",
      "effectMode": "none",
      "effectClass": "read-only",
      "riskLevel": "low",
      "requestedControls": ["sanitize-output"]
    },
    {
      "actionId": "action-read-link-target",
      "stepRef": "step-change-verify-link",
      "position": 5,
      "scope": "request-resource",
      "resourceRef": "ref-task-request-doc",
      "operation": "filesystem.read",
      "effectMode": "none",
      "effectClass": "read-only",
      "riskLevel": "low",
      "requestedControls": ["sanitize-output"]
    },
    {
      "actionId": "action-verify-journal-scope",
      "stepRef": "step-change-verify-scope",
      "position": 6,
      "scope": "runtime-internal",
      "operation": "runtime.verify-journal-scope",
      "effectMode": "none",
      "effectClass": "runtime-internal",
      "riskLevel": "low",
      "requestedControls": []
    },
    {
      "actionId": "action-assemble-change-delivery",
      "stepRef": "step-change-deliver",
      "position": 7,
      "scope": "runtime-internal",
      "operation": "runtime.assemble-delivery",
      "effectMode": "none",
      "effectClass": "runtime-internal",
      "riskLevel": "low",
      "requestedControls": ["sanitize-output"]
    }
  ],
  "riskSummary": {
    "maximumRisk": "medium",
    "triggeredBoundaries": [],
    "requestResourceActionCount": 5,
    "journaledEffectCount": 1
  },
  "authorizationRequestFingerprint": {
    "algorithm": "sha256-jcs-v1",
    "value": "sha256:052db81804c57411d78a7f77fe94ba3a95d70ac3a4bd062f1aadc42bdc41e3a0"
  }
}
